So no Jets fans want Manziel or Bridgewater next year? But a couple weeks ago.......man nvm	40.79163736	-74.00013666	NJ/Home of The Jets 	38994410	1381271708	twitter_iphone
Waiting for @melissat_ at Union Square. Typical. She's always late and I never am.	40.7355926	-73.99123047	Between Love and Hate	22593592	1381271710	twitter_iphone
Martes con s de selebrar:) http://t.co/FeqOSqcySw	40.73892536	-73.86276002		382249081	1381271711	twitter_iphone
It's bad enough that my doctor's office is in Times Square but add a Miley Cyrus appearance at Planet Hollywood and it's that much worse	40.75856693	-73.98462516	New York, NY	29766641	1381271712	twitter_iphone
What happens when trains get delayed... #phuckit @ Blarney Rock Pub http://t.co/fY1ecZwEFG	40.74996979	-73.99019682	jerzey	81194199	1381271715	twitter_instagram
I see you guys are based in Deerfield Beach @ITSUGAR : beautiful town	40.7481881	-73.98334497	wherever Taylor is	390736581	1381271716	twitter_iphone
And I hate that you don't think I belong to ya	40.777454	-74.024866	Union City, NJ	848566500	1381271718	twitter_android
If course the A's choose to blow a 3-run lead right when I get to a TV.	40.73638336	-74.03270472	Hoboken	24492670	1381271723	twitter_iphone
Killed back and bis today.... #FeelsSoGood	40.69261145	-73.93108373	Bed-Stuy, Brooklyn	141058213	1381271724	twitter_iphone
Iowa Alumnj Board meeting! (@ The Irish Exit) http://t.co/SufNDuAWJp	40.75599837	-73.96773333	Forest Hills, NY	87334609	1381271725	twitter_foursquare
Almost caught up on #THEDiRT. The show helped pass the 8 hour drive away.	40.78169646	-74.04809148	Whitsett,North Carolina	182960559	1381271727	twitter_iphone
Dem lips....	40.72760051	-73.99426076	NYC/throbbing boy booties	227563392	1381271728	twitter_other
Peralta crushed it. What a game	40.76639192	-73.92196281	N.Y.C.	101680517	1381271732	twitter_iphone
View from my balcony http://t.co/AyR1443cvx	40.73709623	-73.89917724	Queens NY	48086431	1381271732	twitter_iphone
En France tu connais 2/3 latinos, fin de l'histoire. Ici.. Astarfullah..	40.71828481	-73.98688562	Ghetto Supafly	320114898	1381271737	twitter_iphone
todays sunset is bringing me inspiration in a weird way	40.81032771	-74.00109783		711012512	1381271740	twitter_iphone
#fashiondigitalny (@ The Jazz Room at The Kitano) http://t.co/lSF8y2hVRQ	40.74969864	-73.97999273	New York, NY	231454510	1381271741	twitter_foursquare
Communication Ethics, Law, and Regulation (@ NYU - Woolworth Building w/ 3 others) http://t.co/CkdQThhq01	40.71245904	-74.00835967	New York, NY	1146756355	1381271742	twitter_foursquare
WiFi, Sixpoint Sweet Action and indie media presentation (@ Harvest HQ w/ 4 others) http://t.co/QGmKvoo83i	40.74088421	-73.99128914	Brooklyn, NY	17587553	1381271742	twitter_foursquare
Another day, another sunset. @ McCann New York http://t.co/wz4uQ4MhmO	40.74989042	-73.97601128	New York, NY	369730727	1381271747	twitter_instagram
#nogoddamnfilter @ Party City http://t.co/LDZpC0Rfct	40.7309662	-73.88773441	NYC	872818801	1381271750	twitter_instagram
Ready for the immersion blender #creamofbrassicasoup #brassicaLOVE #foodie #foodporn #cauliflower #veggie http://t.co/PP6iGMLn7p	40.784681	-73.948709	Yorkville, NYC	620611977	1381271761	twitter_other
on da low, low..	40.74384731	-73.99993113		637238804	1381271762	twitter_iphone
#Beautiful #nyc #sky @ 5th Ave NY http://t.co/D7TA4nKXvm	40.76082475	-73.97522336	NYC baby	30682728	1381271766	twitter_instagram
That bomb has a giant * next to it?  #tigers @gabekapler	40.7726309	-73.95634705	NYC	125789082	1381271772	twitter_iphone
Network, learn, progress, celebrate #2013CUNY #YALS @InnovateAfrica @iamokenfe @54kingdoms @AVCaction @USAfricaSynergy	40.74567276	-73.99166687	All around the world.	517930403	1381271777	twitter_iphone
And with all thats been said, I still love you.	40.72008551	-73.96289763	New York, NY	490451886	1381271777	twitter_iphone
Tonight's sunset #nofilter @ Lower East Side http://t.co/mhYN7aLjoy	40.71594005	-73.98682594	New York	215065197	1381271778	twitter_instagram
I'm at AMC Empire 25 - @amctheatres (New York, NY) http://t.co/9B7lAEvPvQ	40.75694538	-73.98887112	Riyadh	77989331	1381271780	twitter_foursquare
I'm at @GramercyTavern (New York, NY) w/ 3 others http://t.co/bMIvk50apT	40.73857556	-73.98832798	NYC | USA	445099629	1381271781	twitter_foursquare
Well earned after work cocktails with @2greggy!! (@ Spice Classic) http://t.co/3hBTmmgVDf	40.74452814	-73.99875337	New York City	115457459	1381271782	twitter_foursquare
Lil Kev if you would have just stayed under the radar you were doing just fine... Now you back to cool as avi bro status	40.70359401	-73.87575625	Queens, New York 	163628817	1381271782	twitter_iphone
National Lupus Gala @ Gotham Hall http://t.co/eVUu3PT9Gt	40.75133907	-73.98724699		188416711	1381271784	twitter_instagram
i don't even care	40.81575381	-73.95916795	new york is nice 	49369940	1381271785	twitter_iphone
RIP BCN	40.76051603	-73.97768087	Jersey City	29467981	1381271786	twitter_iphone
 The feeling Johan Cruyff has had for Barcelona, I have the same with Arsenal.   Dennis has me feeling like Rachel McAdams in the notebook.	40.7677776	-73.96419694	New York	273057167	1381271791	twitter_other
Flatiron Building :) http://t.co/IYpMXF2gR5	40.76824848	-73.98192314	NYC ✈ 	319185454	1381271794	twitter_iphone
Loving this http://t.co/4vdnZMvMJx	40.73723711	-73.89939709	Queens NY	48086431	1381271796	twitter_iphone
I'm at @CraveFishbar (New York, NY) http://t.co/CXQKxz97tn	40.75501625	-73.96852539	New York	52502885	1381271799	twitter_foursquare
Understanding a company's vision (their  why  is key to a user's experience. #ux @ NYU Midtown Campus http://t.co/bzqsRHoHy1	40.75370759	-73.98227119	New York	14322459	1381271800	twitter_instagram
These seats will be full by showtime at #NYTM http://t.co/sNoDqj7jsh	40.7297776	-73.9974336	New Jersey	20526855	1381271801	twitter_android
#radiatewithin #indielee @ MPE Penthouse http://t.co/BJTdzd0hLe	40.760971	-73.992755		116337115	1381271801	twitter_instagram
Why haven't I brought my camera?	40.74584831	-73.98804228	Oakland, CA	16912257	1381271808	twitter_iphone
The GW tonight in B&amp;W.. http://t.co/yZ7HxCnxgN	40.820115	-73.955923	Upper West Side, Manhattan	489571577	1381271810	twitter_other
They're filming law and order SVU right by my apartment! #lawandorder #svu #ilovenyc	40.77872893	-73.95593922	The Big Apple	1223138772	1381271813	twitter_iphone
#Sunset over #NewJersey. Time to go home! #NYC @ WE tv http://t.co/QyysCBckvC	40.74940275	-73.99188995		16113773	1381271814	twitter_instagram
I'm in Copolla's? I dunno, but Britney Spears came here once!	40.78310358	-73.97907755	Eastern America	996092738	1381271815	twitter_iphone
eyes are low .	40.75705275	-74.05094816		355074687	1381271816	twitter_android
Starting a jazz band with @MissMollyPope called Sequin Free.	40.76782799	-73.98321943	New York, NY	21937463	1381271823	twitter_iphone
 @washingtonpost: New surveys suggest Republicans could lose their House majority because of the shutdown http://t.co/X0hjbwuXax 	40.75567987	-73.96900551	iPhone: 38.840260,-77.313110	34016235	1381271825	twitter_other
looking good #nyc. http://t.co/oYEsRfEXHK	40.70948348	-74.0167826	New York, NY	104208673	1381271827	twitter_android
I get it, I get it. I swear that I get it	40.73370161	-73.87006447	miami✈nyc	549026292	1381271829	twitter_iphone
Team @zagat, past and present. #nyc @ Toro http://t.co/xmdadjKoAa	40.74308917	-74.00837689	New York City	15884992	1381271829	twitter_instagram
Dinner with Mom. (@ Franklin Plaza Apts) [pic]: http://t.co/mWVTGin6fd	40.79041075	-73.93977945	New York City	24668895	1381271830	twitter_foursquare
In a New York state of mind. @ Canal Street Shops http://t.co/xuN3mmUe5C	40.71951456	-74.00203587		56319878	1381271836	twitter_instagram
No filters :-) @ Grand Ferry Park http://t.co/JGSfNfeXU4	40.71666935	-73.96710197	BRU/NY/SF	7973652	1381271836	twitter_instagram
I'm at @BentPilates Studio (New York, NY) http://t.co/by0SRT51PO	40.76370625	-73.98849964	Los Angeles	37296743	1381271836	twitter_foursquare
Someday I'm gonna work at nbc. @ Rockefeller Center http://t.co/bA3dHfWGJv	40.75881611	-73.97862105	Earth	222679912	1381271840	twitter_instagram
By far the most purple thing I've ever consumed #strawberryblackberrysmoothie http://t.co/vSo5AoKHkH	40.78629855	-73.94886989		1036215812	1381271841	twitter_iphone
October sky. @ Shutterstock http://t.co/1mR9XMWIDV	40.70548768	-74.01187154	New York, NY	16672818	1381271850	twitter_instagram
Beneath all the sexual tension, Kait and I have a good relationship	40.75798062	-73.99148441	Instagram: dreambignj	291476736	1381271850	twitter_iphone
#NorbertLeoButz #BigFishMusical #broadway #musical #edwardbloom @ Big Fish on Broadway http://t.co/pu85q6EGCN	40.76300234	-73.98463571	West Bloomfield, Michigan	23992370	1381271853	twitter_instagram
SRE Classroom, meeting great people already (at @Google New York w/ 14 others) http://t.co/0dudQRQd3n	40.74093066	-74.00241461	central NJ, phila, nyc	62858595	1381271858	twitter_foursquare
#shakira will be performing tomm nite in Bryant Park - starts at 5:30! Since my hips don't lie, I will b there! #NYC #nbc @FreeConcertsNYC	40.75423291	-73.98535483	Hoboken, NJ	622508196	1381271860	twitter_android
 That is more moi.  @simondoonan on falling in love with window dressing. Yes, @likeyoucare he's here #TEDNYC auditions.	40.72787974	-73.99378796	New York	60212234	1381271864	twitter_iphone
Wts going on here?? Wow @ Mi casa http://t.co/wKbDSimfYz	40.69816781	-73.98336117	Downtown Brooklyn, NYC	295803986	1381271866	twitter_instagram
Over here in my own little world, on the other side of the country... Kinda weird to think about	40.76223443	-73.97890863		1426978194	1381271866	twitter_iphone
That orange. Wow. From @toddandduncan #sohocashmere #want @ Todd and Duncan http://t.co/MHo1D7MunI	40.72241667	-74.001625	East Village, NYC. 	19348897	1381271867	twitter_instagram
Of course the A's choose to blow a 3-run lead right when I get to a TV.	40.7363289	-74.03272535	Hoboken	24492670	1381271869	twitter_iphone
The sky looks dashing	40.73125132	-73.98224618		631749773	1381271869	twitter_iphone
#NP Too Experienced - #BarringtonLevy #TeamJamaica #Jamaican #Reggae #ClassicTune	40.80886412	-73.94841413	ÜT: 40.812739,-73.956154	174809216	1381271871	twitter_iphone
Mmmm....pie! (at @PieFaceUsa w/ 2 others) http://t.co/BHgmfajkZ6	40.74557246	-73.97807581	New York, NY	24021192	1381271871	twitter_foursquare
Fall #sunset @timeoutnewyork offices @ Time Out New York http://t.co/4kTIdqp3rm	40.75616479	-73.99828434	ÜT: 38.717521,-90.306137	21152813	1381271878	twitter_instagram
Always be my babyy	40.75705275	-74.05094816		355074687	1381271879	twitter_android
.@niveausa dinner with @RebeccaMinkoff (at @SalinasNyc w/ @glambr @alywalansky) http://t.co/pjqfkKrzvM	40.74367494	-74.00316063	New York, NY	5174191	1381271884	twitter_foursquare
Dyin to see what you look like naked.	40.78937778	-73.94664223	☁	1615165814	1381271884	twitter_iphone
Holy cow what a sky over NYC tonight.	40.76728009	-73.88669045	NYC	14324866	1381271884	twitter_iphone
View from the Ty Warner suite fsnewyork #newyork @ Four Seasons Hotel New York http://t.co/uLMFqt7YwH	40.76211798	-73.97141601	Cleveland, OH	15873031	1381271887	twitter_instagram
Sunset in Washington square park @ Washington Square Park http://t.co/FoqxnCjdQL	40.73084425	-73.9973563	Massachusetts/NYC	1560106362	1381271894	twitter_instagram
This is why I love NYC @ my balcony http://t.co/AAx5SKHQxv	40.77702715	-73.98355796		117207706	1381271897	twitter_instagram
I'm at Kabbalah Centre - @nyckabbalah (New York, NY) http://t.co/FUvKb4HZgR	40.75505175	-73.97265211	NYC, New York	28211025	1381271904	twitter_foursquare
Last Vegas Screening (@ Regal E-Walk Stadium 13 &amp; RPX - @regalmovies w/ 7 others) http://t.co/6mwFNUHBdZ	40.75699374	-73.989079	Fort Lauderdale	18292725	1381271905	twitter_foursquare
Workout dates are the best! :) (@ Exhale Spa - Gansevoort - @hotelgansevoort) http://t.co/RZwdJZ38KA	40.74000255	-74.00580034	NYC	16666151	1381271910	twitter_foursquare
#cuttingroom #sunset #nyc @ Gigantic Post http://t.co/lkBcuDWgXm	40.74570315	-73.99560163	BOS/LA/NY	17296874	1381271913	twitter_instagram
I'm at Greenwich Village (New York, NY) http://t.co/RHGRv9ELLE	40.72852712	-74.00270462	Oakville (Toronto), Canada	8875942	1381271914	twitter_foursquare
#NYC #newyorkcity #sunset @ LaGuardia Airport (LGA) http://t.co/l3tuxnzHRr	40.773839	-73.87122	Estados Unidos	129720660	1381271916	twitter_instagram
I stay late just for the view. @ McCann New York http://t.co/MUjfrmldZT	40.74989042	-73.97601128	New York, NY	26607370	1381271919	twitter_instagram
aaaand #sunset #nyc incredible sky @ 275 Broome Street http://t.co/hZv7jX8v54	40.71817811	-73.99123424	New York, NY	48057932	1381271920	twitter_instagram
#powerstrike (at @Equinox Fitness w/ 5 others) http://t.co/MxcIYHWvTl	40.75403959	-73.9802223	NYC baby	30682728	1381271921	twitter_foursquare
I'm at @CraftbarNyc (New York, NY) http://t.co/5I75TVxfBS	40.73883035	-73.98984674	Brooklyn, NY	23718810	1381271923	twitter_foursquare
All sequins and sparkles on today's set! #RTRSneakPeek @ Rent the Runway HQ http://t.co/LODspuQaEu	40.72698286	-74.00562244	New York	43122620	1381271925	twitter_instagram
Looking for an excuse to spend here. (@ CVS/pharmacy - @cvs_extra) http://t.co/XdSZrd7Jzq	40.75957212	-73.99544787		15530619	1381271925	twitter_foursquare
How to design your product line to maximize conversions and monetization. @PatLefler http://t.co/8uIGw7safi	40.751667	-73.97407	SFO ✈ NYC ✈ SJU 	37824501	1381271925	twitter_other
I'm at Watawa (Astoria, NY) http://t.co/o5Lar7b2WF	40.77516	-73.9093086	Greece, New York	138146948	1381271930	twitter_foursquare
Holy shit!!! http://t.co/9pSe3JJV5o #frontback	40.71665955	-73.96710205	BRU/NY/SF	7973652	1381271940	twitter_other
might be purple, it might be pink, depending on how you mix that drink http://t.co/vhUPki28hf	40.71758924	-73.95711293	New York, New York	20507510	1381271944	twitter_iphone
Skully season. #nyc #chilly	40.80936478	-73.94914166	ÜT: 40.812739,-73.956154	174809216	1381271944	twitter_iphone
The apple of my eye....... @ AMC Magic Johnson Harlem 9 http://t.co/mZVRHTRxLh	40.80991152	-73.95189285	NY	189594207	1381271946	twitter_instagram
Sunset, people!	40.71568273	-74.01546362	Flatbush, Brooklyn, NY	18176147	1381271947	twitter_android
Not sure @venmo was intended for this, but thanks for the surprise dolla! @izzovizzA http://t.co/mqgzdhNems	40.72325087	-73.99862581	New York	50394941	1381271954	twitter_iphone
homies stay askin if lauryn and I are sisters... #mightaswellbe	40.71077468	-74.00507693	new york,new york	320324450	1381271955	twitter_iphone
81 E  3rd Street Apartment 7c New York, NY 10003 @ New York Law School Residence Hall http://t.co/L4BB8xI40y	40.72506701	-73.98816523		543107711	1381271957	twitter_instagram
That sky. That sunset. Fall, I love you. @ Manhattan http://t.co/7HPNyJ6kx9	40.7442494	-73.99987241	New York, NY	19349780	1381271965	twitter_instagram
At panel discussion in NY on 'Big Data/Global Surveillance'.Place packed, reflecting interest in US.	40.8076071	-73.9601773	New York	21331369	1381271965	twitter_other
Cue all the pretty sky pictures #NYC @ MTV Newsroom http://t.co/Zrp5QderZA	40.75740009	-73.98609638	NYC	29793602	1381271966	twitter_instagram
How long before United fans start saying Jack is worried that Januvaj is gonna take his place?	40.76786825	-73.96411435	New York	273057167	1381271967	twitter_other
In a Boston accent lets go to tha harbor	40.70188498	-73.92995758	BROOKLYN	18455229	1381271968	twitter_iphone
NYC or Cloud City? #nofilter @ Foursquare HQ http://t.co/B3iJO9kxTd	40.72412842	-73.9972651	Brooklyn, New York	44686762	1381271970	twitter_instagram
Menswear luxury outerwear launch by #brettjohnsonco showcased in @HuffPostNY  http://t.co/0PrvnnGozd #PR #Holiday #Fashion	40.7298972	-73.9874089	New York City	29749668	1381271975	twitter_android
#bigfishmusical #musical #norbertleobutz #broadway #nyc #newyork @ Neil Simon Theatre http://t.co/vTrtqkPZAM	40.76308739	-73.98458406	West Bloomfield, Michigan	23992370	1381271976	twitter_instagram
here comes #fall @ 109 E 2nd Street http://t.co/8tRAqfxHPN	40.72296448	-73.98774402	New York	21664072	1381271978	twitter_instagram
The haaaaaa baaaaaaah	40.70197199	-73.92990948	BROOKLYN	18455229	1381271979	twitter_iphone
And by the third page of my essay, I'm rambling	40.71095789	-74.00429886		1049445564	1381271979	twitter_iphone
Love this view #officewindow #frommydesk #nyc #sunset @ Sawyer Studios http://t.co/t05oRD27P4	40.743719	-73.990689	Rumson, NJ	66758558	1381271980	twitter_instagram
Turistear para mi es: caminar 15 cuadras para comer algo rico.	40.73082171	-73.99072146	Top of the Rock, New York	78118381	1381271981	twitter_iphone
#nyc skyline from Brass Monkey rooftop @ Brass Monkey http://t.co/wkmHB7Rin6	40.74072795	-74.00861104		15905770	1381271982	twitter_instagram
Oh heyyyy sexy #sunset! #studioview #officewithaview @ New York City http://t.co/q25yaVieoX	40.77456186	-73.97266388	New York, NY	67910411	1381271983	twitter_instagram
I'm at @CraveFishbar w/ @drollness http://t.co/nq9tGhOLQz	40.75501625	-73.96852539	Chicago	34332528	1381271985	twitter_foursquare
Female Jets fans would hate me if I was a fan of another team Lmao	40.79162419	-74.00027071	NJ/Home of The Jets 	38994410	1381271986	twitter_iphone
From the window of my office! @ Madison Plaza http://t.co/9vPpCHZFy2	40.80153601	-73.94376327	New York	108622323	1381271995	twitter_instagram
This sky again! @ StrawberryFrog http://t.co/LrP1H0zTwv	40.74310185	-73.98656978	Brooklyn, NY	131382996	1381271996	twitter_instagram
I'm at Ted Baker of London w/ @abu4546 @msh_alhudaithy http://t.co/CXUmsy9NML	40.75736087	-73.97817912	Riyadh, Saudi Arabia.	92297926	1381271997	twitter_foursquare
It's interesting to observe you and predict your next three moves. #checkmate	40.7487713	-73.9885875	New York, NY	150064696	1381271997	twitter_android
Don't have high hopes for finding tix to 12 Years A Slave tonight. Was looking forward to seeing it again, this time with @eal7nyc.. #NYFF	40.76065537	-73.99182432	New York, NY	80333792	1381272001	twitter_iphone
Sunset, GREY magazine offices, Tuesday, October 8, 2013, 7:38 pm. @ Christadora House Condo http://t.co/sMPeJ4dFqb	40.726348	-73.980556	New York	1069121485	1381272008	twitter_instagram
I'm at @DuaneReade (New York, NY) http://t.co/1hsfOuscjP	40.70930405	-74.01027918	Where Brooklyn at!	59294611	1381272008	twitter_foursquare
NYC skyline at dusk @ The Standard, High Line http://t.co/gm9Z3bMgzj	40.74088398	-74.00765959	San Francisco, California	3940101	1381272014	twitter_instagram
I'm not one to take pictures of sunsets. But this is a good one. @ Brookfield Place, Winter Garden http://t.co/wGMamu7cyZ	40.71324019	-74.015944	NYC 	175376084	1381272016	twitter_instagram
#nogoddamnfilter @ Party City http://t.co/5wr7oxoFRH	40.7309662	-73.88773441	NYC	872818801	1381272023	twitter_instagram
From toilet demolition to star window dresser @simondoonan @BarneysNY loving freaks &amp; coyote abductions #TEDNYC http://t.co/7jX5UPPicQ	40.72786844	-73.99362568	New York City	231569466	1381272024	twitter_iphone
Acabo de publicar una foto @ St. Mark's Place http://t.co/wIa2iIuuD2	40.72925558	-73.98937615	new york city	613928817	1381272027	twitter_instagram
Finally it feels like Fall. Just the usual passing out in a food coma , laying in front of the television watching NBA TV. #JudgeMe	40.76330292	-74.04099416		300666711	1381272036	twitter_iphone
I'm crying because #NYCC on Friday	40.70727335	-73.95193027	LLAP ⚯͛	456790125	1381272039	twitter_iphone
Favorite Tuesday of the month. #nytm (at @NYUSkirball Center for the Performing Arts for NY Tech Meetup) [pic]: http://t.co/bp5KfeH5dN	40.72973041	-73.99755478	NYC+LA	21563182	1381272043	twitter_foursquare
 I like your beautiful hair, goddess. And I like your dog! You guys make good friends together!  Thank you crazy, high old dude in the park!	40.78267445	-73.97384842	New York, NY	20861958	1381272046	twitter_iphone
As you can see, I ENJOY trolling Jets fans who tweet irrational shit	40.79136964	-73.99988537	NJ/Home of The Jets 	38994410	1381272048	twitter_iphone
I'm at Columbia University (New York, NY) w/ 5 others http://t.co/4jSa4etaUH	40.80821993	-73.96215395		15870244	1381272048	twitter_foursquare
You keep rocking that plaid suit, sir	40.75778728	-73.99112278	Instagram: dreambignj	291476736	1381272052	twitter_iphone
Hate my life.	40.74521092	-73.99459772	NY☪	14971815	1381272053	twitter_iphone
And Saturday and Sunday	40.70713308	-73.95208731	LLAP ⚯͛	456790125	1381272053	twitter_iphone
I'm at Las Olas Sushi Bar and Grill - @lasolas_hoboken (Hoboken, NJ) http://t.co/dprNcUmiUC	40.75298467	-74.02602735	Hoboken, NJ	32488642	1381272056	twitter_foursquare
Just posted a photo @ CORE Group Marketing http://t.co/SMCrBDvUul	40.7410337	-73.99785231	New York, NY	29470605	1381272057	twitter_instagram
Prohibido traer lentes obscuros a la hora que hasta tu sabes que ya no ves bien.	40.76274426	-73.97327264		94382334	1381272061	twitter_iphone
Atardece en Nueva York #NYC http://t.co/93QYvBxHjk	40.75906446	-73.97931341	Mexico City	88324339	1381272063	twitter_other
Mike's birthday dinner pre Beacon show with Carter. (at @BrotherJimmys BBQ) http://t.co/peXgvhPVDW	40.78413298	-73.97762241	Eastern US Timezone	17858342	1381272063	twitter_foursquare
#Peaces #AuRevoir Off to #ChiTown http://t.co/ywHgF3U8hE	40.77640912	-73.87240106	New York City	40814485	1381272065	twitter_iphone
Trying this place out! (at @BourbonandVine) http://t.co/aqpxKdBUG8	40.76495766	-73.91713142	Queens, NY	16337004	1381272065	twitter_foursquare
Beautiful evening sky @ Lower Manhattan http://t.co/oqaQAj6okN	40.71271224	-74.00817031		43643144	1381272066	twitter_instagram
I need an outfit for Friday and a shirt for Sunday	40.70713308	-73.95208731	LLAP ⚯͛	456790125	1381272071	twitter_iphone
It's been awhile but I'm back! (at @NYUSkirball Center for the Performing Arts for NY Tech Meetup w/ @sarkis01) http://t.co/nxEvjVg4RC	40.72973041	-73.99755478		31222696	1381272074	twitter_foursquare
Standing room only--amazing crowd in an actual bookstore. http://t.co/nY9b8Lh1eW	40.715253	-74.01188	Brooklyn, NY 	182420846	1381272075	twitter_other
That's the best part to do overtime http://t.co/4H4paGUzAO	40.743533	-73.9894874	Be the change you want to see	27409493	1381272079	twitter_android
#ICONAPOP #music #nyc #celebrityspotting #newyork @ NYC http://t.co/n2v9CJhmHr	40.75921655	-73.99089697	West Bloomfield, Michigan	23992370	1381272081	twitter_instagram
Mierda de fiebre!	40.73002709	-73.98250793	United States	47204180	1381272083	twitter_iphone
Mind your beeswax lol #Clark's #beeswax @ Barnard College http://t.co/cQkGKLSXSo	40.80960294	-73.96350145	Astoria,NY	353473741	1381272084	twitter_instagram
Ofcourse I ordered the #chickenandwaffles and #grape #koolaid.  #yum @ Amy Ruth's http://t.co/3FO0FVjBTI	40.80228842	-73.95045062	Baltimore, Maryland	85373673	1381272087	twitter_instagram
I'm at Central Park Boathouse - @nycparks (New York, NY) http://t.co/NViuuwvVlQ	40.77506559	-73.96882296	NYC	30540758	1381272088	twitter_foursquare
I could do homework to get me ahead, or I could watch movies in German. #thewave #diewelle	40.70908677	-74.00769542	San Jose 	316568139	1381272089	twitter_iphone
It's getting spooky at @thalassanyc with @djwhitneyfierce @ Thalassa http://t.co/4LSjStVi4l	40.71932411	-74.00962785	NYC	68433786	1381272090	twitter_instagram
#ny #nyc #newyorkcity #fall #sunset @ LaGuardia Airport (LGA) http://t.co/f2WPRNxi44	40.773839	-73.87122	Estados Unidos	129720660	1381272091	twitter_instagram
Eat. With my bro @boardofeud @ Shake Shack http://t.co/Uld4F7H8o5	40.75845678	-73.98914047	Bronx	58952307	1381272092	twitter_instagram
Ew these sunsets over NYC have been so UGLY lately	40.74888962	-73.99066181		445969822	1381272093	twitter_iphone
Paul McCartney is coming to my school tomorrow whaddup	40.7518253	-73.9417979	queens, ny.	764607799	1381272095	twitter_android
Can't say this often but today was a good day.	40.76364546	-73.97713639		160307941	1381272100	twitter_iphone
I'm at @BryantParkNyc (New York, NY) w/ 24 others [pic]: http://t.co/sJXHXjZLnD	40.75398671	-73.98382187	NewYork	339933746	1381272104	twitter_foursquare
Another beautiful #sunset... #nyc #soho #manhattan @ Horizon Media Inc http://t.co/L6dKATJf9O	40.72323319	-74.0063168	Do or Die, BedStuy	144896650	1381272105	twitter_instagram
Ruby meetup! (@ Stack Exchange NYC w/ 5 others) http://t.co/CQKNPJ7duy	40.70897937	-74.00651191	Brooklyn (also NJ and Philly)	17089991	1381272108	twitter_foursquare
So I don't have to look at headband boy on the sidelines anymore?????	40.79176623	-74.00029639	NJ/Home of The Jets 	38994410	1381272113	twitter_iphone
I'm at @NYUSkirball Center for the Performing Arts for NY Tech Meetup (New York, NY) w/ 20 others http://t.co/ehdPNqTAaW	40.72973041	-73.99755478	Barranquilla / Bogota - CO	26768649	1381272113	twitter_foursquare
Drinks with Coworkers... (@ Elmo Restaurant and Lounge w/ @amrogers) http://t.co/Z5pC0IPQVk	40.741797	-73.997271	nyc	70970350	1381272117	twitter_foursquare
Early dinner with the hubby!! Sorry @abn29 @ Shake Shack http://t.co/vUA9SzGOho	40.69220942	-73.98874486	United States	80996883	1381272118	twitter_instagram
Sunset at Chill channel headquarters. @ SiriusXM Radio http://t.co/VVRpwndCJX	40.7587	-73.98248	New York, NY	21797410	1381272120	twitter_instagram
I really don't watch wrestling but I could not resist asking him if it was really him! Hahaa he's Fiiiine!! http://t.co/lE5aNjxvNl	40.75638079	-73.97049446	QUEENS, NY	17779181	1381272122	twitter_iphone
Sunset with epic hdr @ Foursquare HQ http://t.co/P5DUytX6TL	40.72412842	-73.9972651	NYC	14615324	1381272122	twitter_instagram
Final preparations underway for 2013 #theRSA #US Benjamin Franklin Award which will go to the great @WalterIsaacson http://t.co/jrHp7UUJRB	40.75671898	-73.97214185	London, England	71316814	1381272123	twitter_iphone
