Time to get serious about developing Gluten-free.tv @eat24 maybe your SDK can be the local restaurant backbone	40.7482132	-73.98330983	wherever Taylor is	390736581	1381272899	twitter_iphone
2 for 1-design icon edition: Mica Ertugun and i celebrate my friend Mario Buatta and his book @ Mecox http://t.co/bRHeXrOkC1	40.76928024	-73.96295792	Los Angeles, California	158146342	1381272908	twitter_instagram
I'm at AMC Loews 34th Street 14 - @amctheatres for Baggage Claim w/ @supitsmario http://t.co/N6sRBmpwVa	40.75248286	-73.99440915	New Jersey	302792804	1381272913	twitter_foursquare
I'm at Gramercy Theatre for London Grammar (New York, NY) w/ 6 others http://t.co/HVvDYpnKWY	40.73977867	-73.98508787	New York City	14125288	1381272914	twitter_foursquare
safe to say after last nights performance by Geno Smith,Sanchez will never play for the Jets again.So he underwent season ending surgery tn	40.75052344	-74.00836136	Bronx, NY	847486842	1381272915	twitter_android
Hello upper west side! So lovely catching up with @cjwoodin :)	40.77772304	-73.98194674	NYC	21168180	1381272915	twitter_other
Minhas amigas iam amaar isso aqui	40.7565192	-73.99243		343064866	1381272916	twitter_android
 #NYC has more forests, meadows, and marshes, than any city in North America  - Marielle Anzelone @TEDconferences http://t.co/ZGjbjfhDh3	40.72933785	-73.9918783	New York, NY, USA	15701519	1381272916	twitter_iphone
#genblue (@ American Museum of Natural History - @amnh w/ @joshuapatz) http://t.co/cuM3Y8yw39	40.78118444	-73.97320309	Warsaw and Syracuse, IN	50312171	1381272918	twitter_foursquare
Lo shutdown ha rotto i coglioni!	40.74914614	-73.93704638	New York City	88581115	1381272919	twitter_iphone
if you're feeling suicidal, look in the mirror and say  control alt delete  three times. steve jobs appears and tells you it gets better	40.7738005	-73.98412932	New York, New York	56794575	1381272921	twitter_iphone
I'm at Payless ShoeSource - @paylessinsider (New York, NY) http://t.co/Ky5bm9xMUL	40.8091871	-73.948715	Harlem	108183400	1381272922	twitter_foursquare
Finally trying #robertapizza @jcoltun (@ Mad. Sq. Eats - @madsqparknyc w/ 13 others) http://t.co/iKrCKTaOUD	40.74265628	-73.98901463	New York	143264628	1381272923	twitter_foursquare
Cuz I'm prone to eavesdropping, @rachelhaot is here at #NYTM to announce a revamped website for the city (not sure if for a specific branch)	40.7297681	-73.9974322	New Jersey	20526855	1381272926	twitter_android
My lady love @makeuplovesme and me. @ Salinas http://t.co/aMOjH1I6AN	40.74367494	-74.00316063	New York City	6362172	1381272926	twitter_instagram
All I want to do is to watch Halloweentown and eat those pillsbury ghost cookies.	40.75312508	-73.97655242	NYC	515740616	1381272930	twitter_iphone
Happy birthday to my little devil!!!!! http://t.co/e4JVoPFrVJ	40.81359685	-74.01114645	new jersey	488090325	1381272930	twitter_iphone
I wish my life was a movie	40.74842154	-73.93773916	fairfield, CT	213406304	1381272931	twitter_iphone
Chp'den kim cikarsa ciksin,ne olursa olsun kendi kendilerini yedikce Istanbul'u kazanmalari imkansiz	40.78937797	-74.05137423	new jersey	387801281	1381272932	twitter_iphone
Gimme this girl some drinks	40.70733216	-73.94567662	Brooklyn, NY	190098363	1381272938	twitter_iphone
Going to @NY_Comic_Con? Let's go together in the name of @makepenbad @adamrifkin @pennjillette #badpenn http://t.co/Q1oG4vGuSE	40.75768712	-73.96501074	Manhattan 	22609246	1381272940	twitter_iphone
#ChicagoFire #BurntDistrict http://t.co/HKmlkbTYeN	40.71767425	-73.95790419	Brooklyn, NY	236106142	1381272944	twitter_iphone
Somethings are so beautiful they don't even need a filter #amazing http://t.co/taWGRvzEtM	40.77571049	-73.95041022		203702414	1381272946	twitter_iphone
If Steelers get their first win against my boys http://t.co/LezxxVCRTv	40.791712	-74.00023525	NJ/Home of The Jets 	38994410	1381272948	twitter_iphone
Tribute to Tuesday. #tikibar #mydrinkisonfire #nyc #eastvillage #happyhour @ Otto's Shunken Head http://t.co/jMCAjs4lbg	40.72971915	-73.97842632	relocating 	32377221	1381272949	twitter_instagram
Enjoying some delicious @Smirnoff cocktails and tasty bites from @gardein! #seasonofchange	40.74496151	-74.0065028	NYC	44891815	1381272950	twitter_iphone
Round 3 begins! @heyrenae #GenBlue	40.77523104	-73.97601161	Nashville, TN	48784316	1381272953	twitter_iphone
If I see one more sky picture on Instagram ..	40.74757369	-73.99498975		24376649	1381272956	twitter_iphone
Sleigh Bells -   Minnie http://t.co/1GMiZrpBRM	40.7537429	-73.9890101	Queens, NY	23897833	1381272962	twitter_other
waiting for da bae @MileyCyrus	40.75696222	-73.98528689		321446091	1381272963	twitter_iphone
Give this girl some drinks	40.70718514	-73.94550839	Brooklyn, NY	190098363	1381272964	twitter_iphone
And i dont ever tuck my chain nigga how that sound	40.75432456	-74.00698484		556450901	1381272965	twitter_iphone
All I want in life right now is cake, and bed	40.73876393	-73.98759641	ÜT: 40.7224,-74.002059	23910164	1381272966	twitter_iphone
Sunset at Pier 11... http://t.co/BEgjpKkWFf	40.715674	-74.017119	Hoboken, NJ	276789731	1381272966	twitter_other
Where is Eli Manning when you need him? You meaning me. When meaning always.	40.75393844	-73.99161724		179202289	1381272967	twitter_iphone
high school fashion club all over again @einsteincorrea @J_Camacho @ Fashion Institute of Technology http://t.co/KkzvRLAvHT	40.7470944	-73.99452925	greenpoint, brooklyn	354093166	1381272968	twitter_instagram
Is #selfietuesday a thing? Welp too bad :) http://t.co/6NobSK8TfA	40.70726155	-73.95195014	LLAP ⚯͛	456790125	1381272980	twitter_iphone
hot date toniiiiight. i'm kinda nervous.	40.7251544	-73.99639326	brooklyn	7011092	1381272984	twitter_iphone
5 rules of pricing; #startups, listen up...price &amp; cost are unrelated, and you must #getpaid, by @PatLefler http://t.co/Z0bMGBjg3z	40.751656	-73.974078	SFO ✈ NYC ✈ SJU 	37824501	1381272988	twitter_other
This cold front #wtf #hellofall #wannasleep	40.769959	-74.02262384	NJ/NYC	76038615	1381272991	twitter_iphone
Lemon confit in the works for our #CiderWeekNY dinner. @ The Queens Kickshaw http://t.co/frO70eDyOD	40.75877063	-73.91840664	Astoria, Queens, NYC	227381310	1381272992	twitter_instagram
Our view tonight. No filter needed. @ MaisonO http://t.co/gauOjXU1eW	40.72135519	-73.99692847	Jarrettsville, Maryland	263231431	1381272994	twitter_instagram
yaaa :3 @makeupretty1: @adonybleick adoooooni. 	40.7978685	-73.94313829	East Harlem,Manhattan	386834926	1381272994	twitter_android
I'm at New York Sports Club (New York, NY) w/ 2 others http://t.co/tBfTiw5eLF	40.71167219	-74.00845723	From Moscow to New York City  	154174364	1381272995	twitter_foursquare
The sky is every color of the rainbow right now. #sunsetcity	40.77729722	-74.04435597	Instagram: dreambignj	291476736	1381272995	twitter_iphone
Sit with @NYTechWomen stage left toward the front! #nytw (at @NYUSkirball Center for the Performing Arts) http://t.co/BdHPnYbREr	40.72973041	-73.99755478	New York, NY	258508915	1381273000	twitter_foursquare
Here for a talk on Latino and Queer theology. Yes this is what Maribelle and I consider a nice evening http://t.co/mkvZ2OszA0	40.8112658	-73.96199364	ÜT: 40.859121,-73.931501	15436235	1381273003	twitter_foursquare
Listening to Sirens and Mind Your Manners ...Pearl Jam's two new avail masterpieces from their new album!	40.7491609	-73.97353455	NYC | LA | MIAMI | DALLAS	114083305	1381273003	twitter_other
Cry me a fucking River 6 apologists	40.79157645	-74.00010914	NJ/Home of The Jets 	38994410	1381273003	twitter_iphone
Most amazing sunset tonight	40.73368731	-73.98935439		249808952	1381273004	twitter_iphone
I'm admittedly the most rotten person to be behind when I'm ordering a deli sandwich. #WhenHarryMetSallyAnnoying	40.74613736	-74.00044805	Brooklyn	17691709	1381273005	twitter_iphone
Pussy nigga had no brains like he was mental!	40.81296222	-73.94052265	New York	1357800522	1381273005	twitter_iphone
Excited to be back at #nytm! (at @NYUSkirball Center for the Performing Arts for NY Tech Meetup w/ 43 others) http://t.co/MrkhcGMG9T	40.72973041	-73.99755478	NYC, the internet.	97597880	1381273009	twitter_foursquare
Praying for social justice. #POL13 @ Baruch College - William and Anita Newman Vertical Campus http://t.co/bEcQSpoFHh	40.74017406	-73.98357398	Baruch College - New York, NY	268925838	1381273012	twitter_instagram
Nights like tonight are when I miss my dudes from back home a night we drink beer &amp; watch the rays	40.78615493	-73.94863141		483478283	1381273013	twitter_iphone
I'm at Sal And Michael's Palace (Astoria, NY) http://t.co/8K2qgNEZSm	40.76580429	-73.93973541	Brooklyn, NY	271094697	1381273014	twitter_foursquare
Mr. @SeamusMullen &amp; Ms. @NancySilverton pause from prepping @AlexsLemonade. Great cause @chefjwaxman!  #LemonNYC http://t.co/9nvDEeBXpm	40.73069199	-74.00277997	New York City	25756519	1381273027	twitter_iphone
Triple take at a billboard for a show Daniel Radcliffe and Jon Hamm are doing on some network I've never heard of.	40.73309714	-73.98715175	Manhattan, NY	14703332	1381273032	twitter_iphone
#WomenOrNothing @AtlanticTheater to see Sooz (@ Atlantic Theater Company (Linda Gross Theater) w/ 3 others) http://t.co/SAENoLkciq	40.74377803	-74.00154591	ÜT: 35.960232,-83.90401	1448211	1381273033	twitter_foursquare
I'm in the same room with someone who owns 15% of Twitter #millionaire #billionaire #venturecapital #nyu #incredible	40.72888679	-73.99613839	Greater NYC	36549480	1381273033	twitter_iphone
Yellen?  Awwwshhheit. It's on nah.	40.74628616	-73.97610237	New York, NY, USA	29400182	1381273034	twitter_iphone
I wish tomorrow was Friday	40.78980889	-73.96703866	instagram noluvberto	24899552	1381273036	twitter_iphone
NYC &amp; Company's George Fertitta says City welcomed 541K visitors from China in '12 @metmusem @nycgo_press @BrandUSA http://t.co/RyoykaUmCp	40.77815616	-73.96353375	New York, NY	41493340	1381273037	twitter_iphone
It's time for @BigFishBroadway	40.76303965	-73.98447273	New York, NY 	225625268	1381273043	twitter_iphone
http://t.co/ma4y42b7rB	40.730369	-74.05133827		1352469230	1381273045	twitter_iphone
I hate when you text when you're with me ..	40.79325846	-74.00869748		96415799	1381273046	twitter_iphone
#fantasticman #gentlewoman #multiplesignatures #bookshop #glory @ St. Mark's Bookshop http://t.co/hFHBI39CDs	40.73010073	-73.98950241	Brooklyn, New York	74591479	1381273047	twitter_instagram
Here at No Mas screening. Talking to @SUGARRAYLEONARD about how Twitter rules!	40.73133577	-74.00164599	Brooklyn, NY	49215344	1381273053	twitter_iphone
#purple skies tonight @ The Archive http://t.co/I4CPZNVFXk	40.73228568	-74.00817031	San Francisco	7662652	1381273054	twitter_instagram
What a great night for a run by the water #Hoboken @ New York Sports Clubs http://t.co/Bsvs6lJvNw	40.75371971	-74.02833969	Hoboken / LBI, New Jersey	353103752	1381273056	twitter_instagram
Acquired: @notjessewalker book. http://t.co/ng31YtYgxd	40.7428994	-73.9884046	NYC	23123041	1381273059	twitter_android
Weeeee finally (@ Otto Enoteca Pizzeria - @ottopizzeria w/ 4 others) http://t.co/hybDTFTA4m	40.73168165	-73.99618149	New York	58497443	1381273070	twitter_foursquare
Its gonna rain all day tomorrow huh	40.71745404	-73.95827274	Amsterdam	120204788	1381273070	twitter_other
My camera doesn't come close 2 capturing the glory of 2nite's #sunset view from my roof. This place = magic. #NYC http://t.co/QqwuudVczi	40.73980628	-73.99882428	NYC	14590300	1381273070	twitter_iphone
“@JeffBuckley: THE LAST GOODBYE WILL OPEN THE OLD GLOBE’S 2013-14 SEASON http://t.co/5Kvn5gFFHE http://t.co/E6wbwFYQlN” 🎸✌❗💔	40.78263021	-73.95137794	NYC	42369331	1366996061	twitter_iphone
my eyes go from huge or asian looking idgi	40.76152453	-74.04345458	jersey ☯	412655130	1385432110	twitter_iphone
NBA 2H Rockets -4	40.73294285	-73.86712646	Long Island, NY	1711778707	1385432111	twitter_iphone
Pump 96 or higher ...no  whatever 	40.81391981	-73.95869125	A&R|Producer For @bigmikeruler	70432987	1385432118	twitter_iphone
Lemonade?  Why no... It's just a French beer. #colomba @ Brasserie Cognac http://t.co/sdpbRjjEC3	40.7647422	-73.98247206	iPhone: 32.710462,-117.155487	15485206	1385432125	twitter_instagram
I'm flexin on this bitch but I think that her shit stank tho	40.79064675	-73.94263239	trippin w/ Martin	711767172	1385432129	twitter_iphone
sucks for 609 http://t.co/8taGUbMCqV	40.735642	-73.997023	NYC	17498130	1385432129	twitter_other
Tuned into wrestling before I go to bed	40.79068974	-73.94132997	FUCK YOUR LIFE ♥	561088793	1385432129	twitter_iphone
I'm at @BerkeleyCollege NYC Midtown Campus (New York, NY) w/ 2 others http://t.co/4ntNHrBWgH	40.75356409	-73.97953033	New York - Singapore - Jakarta	43280351	1385432141	twitter_foursquare
 @King_Carma: if you aint' oomf I dont want ya 	40.7781646	-74.0306512		1021282957	1385432142	twitter_android
Special after hours members' visit: chasubles, copes, Peruvian textiles. (@ The Metropolitan Museum of Art) http://t.co/bhe0J7AUXB	40.77893666	-73.9622982	New York City	17055595	1385432146	twitter_foursquare
Who all learned they were pronouncing HAIM wrong because of SNL?	40.71680267	-73.94432087	Brooklyn, NY	114646292	1385432150	twitter_iphone
GET ON @CutiieFauxx	40.71419517	-73.94883947	{112413  /Fl/RP/Bi  -}♡	284198090	1385432152	twitter_iphone
I'm at @BerkeleyCollege (New York, NY) http://t.co/L75Ekfg10G	40.75238561	-73.98051739	New York - Singapore - Jakarta	43280351	1385432154	twitter_foursquare
I think these offenses are starting to warm up literally #MNF #SFvsWAS	40.82004228	-73.89615041	Bronx, NY	37596602	1385432156	twitter_iphone
I'm hungry af .. Brigette cooked... I'm hyped	40.77489355	-73.87055052	ÜT: 40.7315822,-73.8741604	319774678	1385432159	twitter_iphone
When I was younger I hanged out with the wrong people &amp; made choices I wasn't suppose to make.now I'm older &amp; wiser &amp; regret mad stuff..	40.7898407	-74.0135851	Spark trees like Marley.	404505071	1385432162	twitter_android
I'm at @Citibank (New York, NY) http://t.co/wXARPQOZlT	40.75304394	-73.97918701	New York - Singapore - Jakarta	43280351	1385432161	twitter_foursquare
HI DAMIEN #RAW	40.72397111	-74.04209196	New Jersey	1859285119	1385432163	twitter_iphone
And I spoke too soon	40.82007326	-73.89615386	Bronx, NY	37596602	1385432164	twitter_iphone
Beautiful installation of @isaacjulien Ten Thousand Waves @museummodernart @ Museum of Modern Art (MoMA) http://t.co/Gs6JoyZQPV	40.76139684	-73.97698575	Times Square, NYC	863596874	1385432165	twitter_instagram
LaMichael James puts in that work	40.76090584	-73.98452947		392403720	1385432166	twitter_iphone
is it me or does tom look tanned!?	40.69471468	-73.94183726	diet mountain dew baby, nyc 	214366007	1385432168	twitter_iphone
In! Ter! Ception! #RGIII!!!	40.74363118	-73.95380025	LIC, New York City	23390625	1385432171	twitter_iphone
I'm flexin on this bitch, I think that her shit stank tho	40.7906469	-73.94263201	trippin w/ Martin	711767172	1385432175	twitter_iphone
I'm at @BryantParkNyc (New York, NY) w/ 11 others http://t.co/cIu3vZEwO2	40.75398671	-73.98382187	New York - Singapore - Jakarta	43280351	1385432176	twitter_foursquare
Catfish is such a fucked up show but I can't stop watching it	40.71044508	-74.00462038		28716527	1385432178	twitter_iphone
pero why am I hungry 25/8	40.76152453	-74.04345458	jersey ☯	412655130	1385432178	twitter_iphone
Take your atrocious behavior and shove it up your ass #SorryNotSorry	40.76795332	-73.99169266		1237062066	1385432184	twitter_iphone
Idk if I'm hungry or bored	40.77760159	-74.02875704	Server at Red Lobster 	242109086	1385432188	twitter_iphone
Your's may be correct, but mine is too @quinnpieper @AlainaDuner @superannie500 @A_Lister__ http://t.co/7RCicrXOSd	40.74597663	-74.0398815		1478566838	1385432188	twitter_iphone
What ear? http://t.co/DXTNjQ4LhL	40.77179581	-73.95017673	New York, NY	50887454	1385432189	twitter_iphone
I'm at Hotel MELA (New York, NY) http://t.co/ZiLLm4GgV7	40.75658451	-73.98451519	ÜT: 33.875678,-84.379559	16267684	1385432193	twitter_foursquare
Kinda hoping Oprah is the new Buddha	40.69369826	-73.94718504	ur bed	19755826	1385432197	twitter_other
I'm at Koi @ Trump Soho (New York, NY) w/ 2 others http://t.co/mz3bo96Fn3	40.72567962	-74.0054962	ÜT: 40.739301,-73.987612	18764468	1385432200	twitter_foursquare
I don't drink liquor but I sip lean tho	40.79064692	-73.94263197	trippin w/ Martin	711767172	1385432208	twitter_iphone
I'm at @OvertheEightBar (Brooklyn, NY) http://t.co/KadrbwSG9H	40.71819751	-73.9523104	NYC	15953110	1385432213	twitter_foursquare
Be careful RG3!!! It's the #niners defense that u are playing the #Giants LMAO!!!	40.82156678	-73.95287621	HARLEM WORLD	167818866	1385432215	twitter_iphone
My two favorite men! @seanmullins @TomTrayer http://t.co/1wFEDPDjrf	40.76430397	-73.9857069	New York, NY	38670410	1385432215	twitter_iphone
I feel like this free calendar is my prize for grocery shopping #drunksgiving @ New York Mart http://t.co/le42S1MpgM	40.7184992	-73.99673335	New York	293708112	1385432215	twitter_instagram
Yeah, you can't question the cleanse of a worker at a fast food joint and then order food anyway. F-n nonsense!	40.82142571	-73.95480834	New York, NY	24471223	1385432223	twitter_iphone
Sometimes life has to drag you like a ghetto bitch for you to wake up and truly find yourself.	40.75228754	-73.94418537	New York	18318926	1385432227	twitter_iphone
keep em comin	40.81569334	-73.95922255	new york is nice 	49369940	1385432229	twitter_iphone
My dad sent me two emails and left me two voicemails telling me he set up a dentist appointment for me tomorrow.	40.71765664	-73.95793307	Queens / Brooklyn	198597249	1385432231	twitter_iphone
I wish you were here for me , Like I was for you #lessonlearned	40.75740135	-74.0401641		376893719	1385432234	twitter_iphone
Doctor Who in 3D in 45 minutes. Can. Not. Wait.	40.756714	-73.98755	New York	20072877	1385432238	twitter_android
The para in film annoys me so much @antoniameditz I'm getting chills just thinking about her and her telling me to stop  eating garbage 	40.72000088	-73.87297489	magic kingdom. 	747254238	1385432246	twitter_iphone
http://t.co/crYdI6ufZK	40.72759138	-73.99427894		318078045	1385432247	twitter_iphone
Wtf henrik?	40.6976313	-73.99309747	Strong Island/NYC	37225019	1385432252	twitter_iphone
My feet have frost bite	40.7565774	-73.92549635	new york city	706019419	1385432262	twitter_iphone
Omg my last tweet was so aggressive lmao #word	40.71104002	-74.00505274	New York City	493510748	1385432265	twitter_iphone
Um... Embarrassed with riches. Woody Allen in the house. Oh. F'n my! @ Cafe Carlyle http://t.co/s8zFYho1Mf	40.77436982	-73.96334249	Manhattan Beach, LA Co., CA	46755112	1385432266	twitter_instagram
Got no time for that hating shit.	40.71516133	-74.04900265		715023808	1385432268	twitter_iphone
Bendel's is killin my vibe~decline my card bc I'm across the country	40.7459755	-74.03988844		1478566838	1385432269	twitter_iphone
I'm at @Sojourn_nyc (New York, NY) http://t.co/heC0hyJD5v	40.77352118	-73.95554203	New York	257592283	1385432274	twitter_foursquare
Fun night. Wonderful ensemble. Go see First Date before it closes Jan 5! (@ Longacre Theatre w/ 5 others) [pic]: http://t.co/PWjX61d7ON	40.76058635	-73.98576631	Southern California	39951062	1385432275	twitter_foursquare
I miss Talbot...sorry Henrik #NYR	40.77618552	-73.97948749		44035041	1385432276	twitter_iphone
OMG I need Robin Thicke's piano from #TheVoice tonight in my house right now.	40.69603805	-73.98280287	#Houston   #RiceU  #NewYork	280203033	1385432276	twitter_iphone
http://t.co/wpX7XhXbVC	40.70030516	-73.98557623	Brooklyn ✈ Orlando ✈	1607484733	1385432276	twitter_iphone
Starship - Nothing\	40.69847033	-73.95144224		1524421386	1385432282	twitter_other
my beloved Ali - float like a butterfly - you were a regal, magnificent creature, exquisitely loved #Ali http://t.co/xWZ80aFnOE	40.746027	-74.007741	seattle	1591918188	1385432282	twitter_other
Deletes tweet. Lol	40.71853451	-74.04338711	jersey city	273204291	1385432284	twitter_iphone
you come ova my place, we make love and then we fuck and then you give me my space	40.78134301	-74.02705519		551379828	1385432284	twitter_iphone
miercoles de Los Adolescentes y el Torito... o de Arkangel Plan B?	40.75873755	-73.86866894	azogues-new york	212274436	1385432289	twitter_iphone
I'm at The Blind Tiger - @blindtigernyc (New York, NY) w/ 3 others http://t.co/SsFbsx1xrF	40.73185407	-74.00335	NYC	155398825	1385432291	twitter_foursquare
Looks like Shakespeare is next on my hitlist :) I'm up for the challenge	40.7490873	-74.0014254		1872988754	1385432293	twitter_android
I'm at Fontana's Bar (New York, NY) http://t.co/DabWBkxs7o	40.71815359	-73.99221117	New York, NY	14520436	1385432296	twitter_foursquare
Great field position now we need to capitalize on the turnover. #niners	40.82154872	-73.95253511	HARLEM WORLD	167818866	1385432298	twitter_iphone
Blast from the past! (at @ModernPinball NYC w/ 6 others) [pic]: http://t.co/ZObldaIdNF	40.7410224	-73.9816761	Farther Away (& Manhattan)	16262277	1385432299	twitter_foursquare
https://t.co/ciCxvqzmEO	40.7456668	-73.9226422		485205694	1385432300	twitter_android
Dinner with a miami friend :) (@ Room Service w/ 3 others) http://t.co/dCbIFc546t	40.76184697	-73.99015091	NYC 	99433916	1385432301	twitter_foursquare
Herald Square waiting to do a rehearsal!! #macysthanksgivingdayparade @ Herald Square http://t.co/oUwbvxXO9n	40.7498254	-73.9879632	Albuquerque, NM	1600396633	1385432302	twitter_instagram
i'd very much like to appropriate tom's culture...	40.69458975	-73.94181236	diet mountain dew baby, nyc 	214366007	1385432303	twitter_iphone
Bitches be putting niggas in the friend zone just so they can say they have a friend zone.	40.69648666	-73.97112943	Brooklyn, N.Y	25229729	1385432303	twitter_iphone
Ariana grande! http://t.co/7jmckcxlg5	40.75028107	-73.98893039		409999232	1385432304	twitter_iphone
Untitled http://t.co/Usjqlo7sxN #candid #street #nyc #halloween	40.736283	-73.997726	Moscow	75591671	1385432307	twitter_other
Jesus I need some lessons on how to not give a fuck	40.73894863	-73.98546363		325376976	1385432308	twitter_iphone
At 3D screening! The Day of the Doctor had me in tears! Good Job Moffat! Great job cast! #DoctorWho50th	40.73386764	-73.9900589	NYC, LA, Central TEXAS	400575623	1385432309	twitter_iphone
I never had anxiety issues before coming to college	40.73116732	-73.99499272	NYU	413420517	1385432311	twitter_iphone
Weatherford tweets about drug test: Steve Weatherford was one of the bright spots for the Giants on Sunday,... http://t.co/q6mGHMdzeM	40.71669795	-74.00001602	New York	53932318	1385432318	twitter_other
Had one #bourbon and one #beer.  Someone find me a #scotch and #GeorgeThorogood and let's make a night of it.	40.74370046	-73.98281024	Los Angeles	277752828	1385432318	twitter_iphone
Coughlin says Giants will fight until very end: The doomsday scenario is in effect for the Giants, who knew they... http://t.co/rpSbayyEHb	40.71669795	-74.00001602	New York	53932318	1385432318	twitter_other
I'm hungry ...	40.75370203	-74.02829099		469574640	1385432318	twitter_iphone
I wish I was those girls that eat the whole universe and don't get fat	40.74655873	-73.91475125		803657124	1385432321	twitter_iphone
It's a small world and hoes make it even smaller	40.71408711	-74.05273746		715023808	1385432324	twitter_iphone
If RGIII had blocked that playaction pass better he wouldn't have made a terrible decision. #sarcastictweet #HTTR	40.78483037	-73.97029685	New York, NY	113145856	1385432326	twitter_iphone
I learned Hennessy and enemies is one hell of a mixture	40.79267005	-74.02276162	Jersey 	259482997	1385432331	twitter_iphone
omg. Do you know. How it feels to be done with this essay and citation? I think I'm abouta cry from joy.	40.75187342	-73.88660272		707256815	1385432332	twitter_iphone
Does anyone know where #GeorgeGalati from #DinnerImpossible is?	40.76935021	-73.92516247	New York, New York	40237433	1385432334	twitter_iphone
Every time I drink a mojito it reminds me if Miami nights @ColbyGouldrup	40.75676037	-73.98819389	Coastal Carolina University	431390850	1385432338	twitter_iphone
Yeah... So what? I'm watching fashion police in bed	40.72068939	-73.99894716	New Dork City	19620136	1385432339	twitter_iphone
The Navy uniforms for this weekends games are the sickest thing I've seen http://t.co/49vTpWMpC2	40.73210756	-73.97623001	New York	402268968	1385432349	twitter_iphone
#teabag	40.69449097	-73.94191772	diet mountain dew baby, nyc 	214366007	1385432353	twitter_iphone
HERE LIES LOVE Philippines Benefit Concert at Terminal 5 http://t.co/WT3PRK9L4I	40.76939328	-73.99389996	NYC by way of Tennessee	595840899	1385432356	twitter_iphone
These alarm sounds are way too peaceful how is someone supposed to wake up to 'Rays of the Sun'??	40.808286	-73.9645266	Universal	1290932870	1385432356	twitter_android
Bill's Bar &amp; Burger kills Five Guys #heavenonearth #bestburger http://t.co/Cidx5Z5ou4	40.76358621	-73.98412494	Tarpon Springs, FL	1368142916	1385432356	twitter_iphone
Oh NYC lemme count the ways I love thee... @ The Breslin Bar &amp; Dining Room http://t.co/mlNIQTtO1i	40.74583735	-73.98799265	ÜT: 25.7924,-80.28509	95975461	1385432358	twitter_instagram
I still don't get how people meet through the internet..	40.73154561	-73.98758615		252722563	1385432358	twitter_iphone
Writing this essay ..... Going HAM !	40.7586698	-74.0489679		355074687	1385432359	twitter_android
The baskets people I'm #nyc use to do their #Thanksgiving shopping @traderjoes #NYC http://t.co/SZIPDAm3pQ	40.77552252	-73.98209545	New York, New York	131601358	1385432360	twitter_iphone
so I'm from NY and I can safely and confidently tell you all the following ... THERE'S NOTHING HARDCORE ABOUT THE HAMPTONS!!!!! #RAW	40.7389868	-73.8672872	kik: mjim85	785788710	1385432361	twitter_android
What's with Rachel's hair?	40.78412375	-73.9801237	APTHORP	1628254364	1385432363	twitter_iphone
