#Wake Up in #Brooklyn... @ Hotel Le Jolie http://t.co/5aXREre9sE	40.71660077	-73.95056784		259797929	1381270382	twitter_instagram
I'm at Mad. Sq. Eats - @madsqparknyc (New York, NY) w/ 10 others http://t.co/q84kb8GnOX	40.74265628	-73.98901463	Brooklyn	41247812	1381270388	twitter_foursquare
Off to @NYTM in #taxioftomorrow w/#gloverparkgroup's @jennamatecki &amp; @bgluckman; @StickShift_VF driving. http://t.co/YZnVvAQjzo	40.735176	-73.987907	Brooklyn, NY	5514642	1381270393	twitter_other
lol yeah right fuck school	40.74763055	-73.99610782	New York City 	51544101	1381270401	twitter_iphone
happy I get to focus on school now	40.74770153	-73.99616229	New York City 	51544101	1381270401	twitter_iphone
Meanwhile in Steelers Nation http://t.co/EdTAachzcd	40.79188762	-74.00038351	NJ/Home of The Jets 	38994410	1381270403	twitter_iphone
If you were any less in shape you'd be in a coma.	40.69411936	-73.92104509	Virgo Megacluster	64663266	1381270406	twitter_iphone
This crooked mind of mine had you shook all the time	40.79925149	-73.94668769	New York, NY	1931360646	1381270406	twitter_iphone
Ink Master, beers and a lease signing. I'm def the hardest working man in real estate. (@ American Whiskey) http://t.co/9IzWG5e4Q1	40.74926446	-73.99426568	NYC	14139345	1381270413	twitter_foursquare
Is there way to make the space bar bigger again I hate this shit I'm.always.typing.like.this #iOS7Problems	40.73912146	-74.02974252	Hoboken, NJ	295456606	1381270414	twitter_iphone
lol yeah right fuck school	40.74763055	-73.99610782	New York City 	51544101	1381270422	twitter_iphone
Gatsby's world NYC!!!!!! http://t.co/Q77nICi9bs	40.76114721	-73.97133695	México	90950820	1381270425	twitter_iphone
On my way to teach karate, if anyone wants their kids to have a free tryout lesson hit me up	40.72464835	-73.89766253	Queens, NY	552939741	1381270437	twitter_iphone
It by home staying at tonight (@ P.S. 13) http://t.co/JGj1DwIqPs	40.73791872	-73.86764903		32810731	1385432685	twitter_foursquare
Music writing in my head :)	40.7586698	-74.0489679		355074687	1385432689	twitter_android
Check out my new ride http://t.co/lvuttGSLFu	40.7740065	-73.9945008		868002253	1381270429	twitter_android
I'm at Hotel Tortuga (New York, NY) http://t.co/JmrCX6ZhL8	40.73253747	-73.98533014	Auckland New Zealand	21545115	1381270432	twitter_foursquare
I walk in the bike lane #idgaf	40.75971427	-73.98795112	Instagram: dreambignj	291476736	1381270432	twitter_iphone
Greenpoint Ave #sunset #nyc @ Studio 220 http://t.co/BHXWCnL2R8	40.72995758	-73.95828247	New York City	258673701	1381270435	twitter_instagram
New... Panic at the Disco - Miss Jackson - feat. Lolo http://t.co/xJBpOILlMs	40.7539097	-73.9895147	Queens, NY	23897833	1381270440	twitter_other
#RedCarpet #Time #12YearsASlave @jaegerlecoultre and @FilmLinc, @TheNYFF #NYFF #Cinema #Partnership http://t.co/wo9GrpgFno	40.77296738	-73.98328953	Le Sentier, Switzerland	182819292	1381270440	twitter_iphone
I'm at Central Park Running Path - @nycparks (New York, NY) w/ 8 others http://t.co/CixQZax1NC	40.7689206	-73.97960246	41.06698,-73.696558	193297357	1381270440	twitter_foursquare
I'm at Ten Over Ten (New York, NY) http://t.co/oGvL4kgbyu	40.71590072	-74.00878432	New York	25079580	1381270445	twitter_foursquare
t-45 minutes	40.75805624	-73.98532252		607799892	1381270455	twitter_iphone
Your d half staff	40.75088927	-73.99300879	Brooklyn	81664952	1381270456	twitter_iphone
If you juat joined us, welcome! The USA Recce Trip is kicking off, best you check out http://t.co/D8PhIBqdGt and get to grip with the vibe!	40.7044798	-74.0145476	Southern Africa / USA	122763263	1381270458	twitter_android
 I mean it doesn't taste like poison  #juicecleanse http://t.co/oBYfwKKAWI	40.78724084	-73.973835	manhattan	118195013	1381270464	twitter_iphone
Chairing YJP Media Summit (date night w @carriekerpen part 1 of 2!) (@ Chelsea Pearl) [pic]: http://t.co/3wxjcPtCfl	40.741304	-73.99585	New York, NY	10437802	1381270477	twitter_foursquare
Crossfit + hours of Homework = not a good mix http://t.co/QA63iFtVU5	40.70999087	-73.86651305		15226638	1381270479	twitter_iphone
One more visit for these braces then I can finally get them off hopefully	40.78015893	-73.95456294	New York City/Montreal	158212695	1381270481	twitter_iphone
I wonder how many times besides today, I've walked passed Diane Keaton not realizing it was her	40.70823552	-74.01390884		408988325	1381270493	twitter_iphone
I want to get a Tatto this weekend	40.70122321	-73.9772279	New York City	92703110	1381270495	twitter_iphone
No NJ trains running. I'm screwed.	40.7503526	-73.99124933	NJ and NYC	251467804	1381270498	twitter_iphone
Welp, guess I better bump up that cardio if I'm joining the company soccer team......! (@ Planet Fitness Wall Street) http://t.co/DQJyi7IDDV	40.70580095	-74.01348399	New York, NY	227479395	1381270500	twitter_foursquare
Come by in 22 minutes and see my low tide, I'll be 31 inches shallower than my usual level. I'll be much lower than usual.	40.723974	-73.922732	Brooklyn & Queens	460759854	1381270502	twitter_other
Someday I'm going to have enough cash, in reasonably small bills, to pick a food truck and proceed to buy food from it. #Food	40.72955861	-73.99656574		314113086	1381270504	twitter_iphone
YESSSS I passed all of Gracie's fashion checks and she's finally gonna build the boutique! #acnl	40.7536636	-74.04645061	NJ	21132588	1381270505	twitter_iphone
Didn't know it disappeared :: Neptune's lost inner moon found http://t.co/PkSXGv0wKl	40.740328	-74.0090612	San Francisco, California	3940101	1381270506	twitter_android
Pretty women with the #bff that looks hit&lt;	40.72742801	-73.98242253	N.Y.C. - MIA - L.A.	44004810	1381270513	twitter_iphone
Checking out a new spot...for me (it's been here almost 2 1/2 years)! (at @BadHorsePizza) http://t.co/grdUzf3zbf	40.80699136	-73.95339527	wherever style resides	32784623	1381270520	twitter_foursquare
#bangerz #mileychrist @ Planet Hollywood http://t.co/qY7RFLfsz1	40.758241	-73.985339	New Jersey	27721391	1381270523	twitter_instagram
 To hell with good intentions...  all ready for tonight's F L O W set. In the area? Come on over! http://t.co/gAcd9dgun1	40.72220556	-73.98172023	New York City, NY	47690165	1381270524	twitter_foursquare
#French #desserts you can't miss out on! #yummie #food (@ Casimir &amp; Co - @casimirny) [pic]: http://t.co/NJwUrRg71Q	40.77119352	-73.96189607	New York / Belgium	50800565	1381270529	twitter_foursquare
I'm talking 18 wheeler hit.	40.72753675	-73.98259459	N.Y.C. - MIA - L.A.	44004810	1381270531	twitter_iphone
If you call Mark Zuckerberg  Zuck-dawg  when you play tennis together, this could be the phone for you!!  http://t.co/ux9V6FCFOu	40.763645	-73.984897	VAN | LA | TO | NY	97562982	1381270532	twitter_other
OMFG I WAS WRONG. HE WAS FOLLOWING ME!!! HE STOPPED TO TALK TO ME!!!	40.69504619	-73.93828508	LAS VEGAS--MANHATTAN--BROOKLYN	214366007	1381270534	twitter_iphone
I'm next #swimming #heraldsquare #goodcause @ Herald Square http://t.co/4nZqwfCzGJ	40.7498254	-73.9879632		37470973	1381270537	twitter_instagram
Nobody understands my love for French bulldogs	40.7374797	-73.99737507		631749773	1381270543	twitter_iphone
I panic easily and think of the worst possible outcomes if situations. BAD HABIT	40.76732288	-73.86726992	New York City	55629039	1381270544	twitter_iphone
What great finds.... http://t.co/CwoivyPVqn	40.7517289	-74.0267166		93521398	1381270547	twitter_iphone
Forever a kid @ Toys R Us http://t.co/LLVjTW1ZfT	40.75727262	-73.98569171	34.982175; -81.08911	183013850	1381270553	twitter_instagram
Elephants and dinosaurs! @coldwellbanker #genblue http://t.co/Uiu2T5ug8a	40.78089789	-73.97315765	Cabot AR	222196001	1381270557	twitter_iphone
I'm at Home!! (New York, NY) http://t.co/uSQ3i6XnkK	40.72454481	-73.94186034	Brooklyn, NY	24551048	1381270558	twitter_foursquare
Put Your Hair In A Bun Nd Handle Your Shit	40.81886576	-73.95619537		1002546498	1381270565	twitter_iphone
I'm at Greenpoint (Brooklyn, NY) http://t.co/XFRu4tuZqU	40.72373001	-73.9508307	Brooklyn, NY	24551048	1381270566	twitter_foursquare
If you just joined us, welcome! The USA Recce Trip is kicking off, best you check out http://t.co/D8PhIBqdGt and get to grip with the vibe! 	40.7044798	-74.0145476	Southern Africa / USA	122763263	1381270580	twitter_android
I bet you'll find another	40.7993195	-73.94664467	New York, NY	1931360646	1381270580	twitter_iphone
Craving rumba baddd	40.7388909	-74.0396334	NJ/NY	65410036	1381270585	twitter_android
Rep. Charles Rangel arrested for protest in Washington DC: Congressman Charles Rangel was arrested by the Park... http://t.co/rzImYfPnNv	40.71669795	-74.00001602	New York	53932318	1381270592	twitter_other
#NYCC event! (at @GriffinNy w/ @val1128) http://t.co/vygZuwe8as	40.7394499	-74.00677014	New York, NY	298626580	1381270593	twitter_foursquare
Brooklyn Night Bazaar Will Operate Year-Round In Greenpoint: The popular Brooklyn Night Bazaar, which attracted a... http://t.co/aBEp2YLCW2	40.71669795	-74.00001602	New York	53932318	1381270593	twitter_other
Tasting the whiskies from The Lost Distillery! @ Brandy Library http://t.co/5IuadA6pFW	40.71981	-74.007007	Brooklyn, NY	90934737	1381270594	twitter_instagram
Get Your Tickets For The NKOTB Cruise, Departing From NYC Next June: As a devoted forever New Kids On The Block... http://t.co/kFbsf6ccVI	40.71669795	-74.00001602	New York	53932318	1381270594	twitter_other
@n_al2 ألغايب الحاضر .. الشاعر ناصر بن عبدالله آل ثاني #FF_Specialツ اشتقنا إليك فعلمنا أن لا نشتاق	40.76245	-73.977137	NEW YORK 	558750658	1366996197	twitter_other
Getting ready for winter!!! #winter #cold #coat #nj #hudson #river #nyc #style #isalatouchestyle #personalshopper http://t.co/piIcSmSCFy	40.7162402	-74.01587295		1090325732	1385432626	twitter_iphone
Fuck I just want a glass of wine, chicken nuggets, and Ryan Gosling in my bed	40.73653561	-73.9916921	212	341559143	1385432675	twitter_iphone
People who love to eat make the best type of friends	40.70122096	-73.98788095		542058558	1385432675	twitter_iphone
I'm so amazed! Let's go #encoreCORBIN !!! I've been hit by smooth criminals!!	40.72683204	-73.9788574	New York	39050986	1385432676	twitter_iphone
B	40.7867998	-73.98132156		80687359	1385432677	twitter_iphone
I'm at LIC Bar (Long Island City, NY) http://t.co/LJgjpuIyk8	40.747002	-73.952798	New York, NY	16308790	1385432678	twitter_foursquare
Niiiiiiice Corbin &amp; Karina!! They kicked ass!! #dwts	40.6932388	-73.8995691	Queens, NY	23897833	1385432680	twitter_other
My chemistry class was canceled for tomorrow. Praise The Lord above	40.75814233	-73.96666288	Manhattan 	633177079	1385432682	twitter_iphone
Tweet tweet	40.75652376	-74.03750262	new jersey	495423597	1385432689	twitter_iphone
After much study, I conclude that @mayagsachdev has a much more complex accent than some New Yorker. I'll have to study some more...	40.76364465	-73.98512883		2159407173	1385432690	twitter_iphone
I've had sex with all of you. Yes, even you.	40.7175708	-73.95796663	Queens / Brooklyn	198597249	1385432695	twitter_iphone
Honored that @BeautyandEssex #regrammed my @instagram of my epically delicious Sunday brunch http://t.co/eZ6q0yo6QL	40.73070285	-73.98015143	New York, NY	401703632	1381270594	twitter_iphone
Week One of the Shop Owner Challenge compete! Woo! (@ Shapeways HQ) http://t.co/xb62FEGYLt	40.74369458	-73.98374615	New York, NY	47824384	1381270595	twitter_foursquare
Daily Telegraph also splashes attack on Guardian. M15: leaks a gift to terrorists to attack us at will.	40.80794098	-73.95986722	New York	21331369	1381270596	twitter_other
Photo: Barefoot Beer-Drinking Subway Riding Mama Knows How To Unwind: We tend to rag on rude subway riders, but... http://t.co/cykfz7Gydx	40.71669795	-74.00001602	New York	53932318	1381270596	twitter_other
New Banksy Piece Goes Up In Greenpoint (Only To Be Taken Down Within Hours): Banksy has just posted this photo of... http://t.co/gPAYstVPoV	40.71669795	-74.00001602	New York	53932318	1381270597	twitter_other
Video, Photos: This Guy Keeps Tagging The Banksy Pieces: Yesterday, just after the location of Banksy's new piece... http://t.co/YK8pEf4L4w	40.71669795	-74.00001602	New York	53932318	1381270598	twitter_other
Fall #2013 NYC @ Superior Florist http://t.co/sHHILgtDni	40.74650587	-73.99012221	New Jersey	176423341	1381270600	twitter_instagram
Holy shit man I'm not touching another beer til Sunday	40.79157257	-74.00007438	NJ/Home of The Jets 	38994410	1381270604	twitter_iphone
Ivette's son is so cute!	40.77798621	-74.01984368	New Jersey.  	30950749	1381270606	twitter_iphone
So Miley Cyrus Is in @PlanetHollywood. #MileyCantTwerk	40.75842705	-73.98430915	Elmhurst & Bronx NY, Newark NJ	127648148	1381270615	twitter_iphone
The new lays commercial is too close to my life, and I don't know how to feel about it	40.69075382	-73.91852434		1219283058	1381270619	twitter_iphone
45 more minutes till the the first day of say yes to the beats and no to the streets kids breakdancing class!!! 7pm 80th st &amp; roosevelt ave!	40.74185706	-73.86633991	new york	52636361	1381270619	twitter_iphone
I'm at Meade's Restaurant (New York, NY) http://t.co/o1pXo73Bsm	40.70815731	-74.00193257	Manhattan, NY	19625559	1381270628	twitter_foursquare
Just saw this lady paint her nails and drive......	40.73451951	-74.04398007	Dont worry im a doctor 	394969274	1381270634	twitter_iphone
If it makes you happy, it can't b that bad	40.71738806	-73.98497467	the halsey j	1910216960	1381270634	twitter_iphone
There's honor in being honest. As per @audubon_	40.72738655	-73.98248075	N.Y.C. - MIA - L.A.	44004810	1381270636	twitter_iphone
60 some hrs left. Help us get to to goal. http://t.co/vFFe76WPIK. @SHoney73  CALLING ALL FANS. CALLING ALL FANS!	40.78571934	-73.97559916	Manhattan	159643163	1381270639	twitter_iphone
I'm at @HighLineNyc (New York, NY) w/ 10 others http://t.co/dakZu75btN	40.74706189	-74.00519371	NYC - Hells Kitchen	52382923	1381270639	twitter_foursquare
I just love that you're dead inside	40.73684601	-73.99846278		55302707	1381270646	twitter_iphone
Above all else Happy birthday to the lil homie!!!! http://t.co/tloerE6LLF	40.77030851	-73.98807325	Upper End, New York	378368728	1381270647	twitter_iphone
im eating hot cheetos and my nose is running cc: @djsweatydank	40.81572393	-73.9590652	new york is nice 	49369940	1381270650	twitter_iphone
Drug deals, murders, and beat downs:  they're witness to it all #PIC	40.74720356	-73.97629444	New York, NY, USA	29400182	1381270654	twitter_iphone
Elephants! @coldwellbanker #genblue http://t.co/sWI5ROzFsC	40.78083003	-73.97291294	Cabot AR	222196001	1381270654	twitter_iphone
Gracias bella:* @claracalderon04: @anitapaulino07 me gusta tu avatar!! 	40.7895669	-73.9460662	NYC!	722612593	1381270659	twitter_android
Puerto rican food :-P	40.7502287	-74.0323703		301481368	1381270659	twitter_android
 I don't care if you call me a dyke, I care if you spell it correctly.  -Sally Kohn @tedconferences audition http://t.co/uBIoHucX7Q	40.7293667	-73.9918799	New York, NY, USA	15701519	1381270659	twitter_iphone
My boss dorvil start tweet haad lol a wah gwaan	40.69191673	-73.9592249	Jamaica	220365009	1381270661	twitter_android
People who watch Elementary- we're filming in the same studio today! Trying to casually steal their food...	40.7412687	-73.9389289	NYC	17273471	1381270662	twitter_iphone
Really when my last person comes in the laser won't work like really wtf how I have to sit here trying to fix this shit	40.72304041	-74.00240367	new jersey 	55315333	1381270662	twitter_iphone
I'm at New York Penn Station (New York, NY) w/ 57 others http://t.co/y6keKQqwnH	40.7507948	-73.99357639	Everywhere 	246429091	1381270663	twitter_foursquare
Life us but a dream	40.7388909	-74.0396334	NJ/NY	65410036	1381270673	twitter_android
I am interested in socializing, anyone interested? #social #conversation #gettoknowme	40.75394593	-73.9929339	New Jersey	102291441	1381270677	twitter_iphone
Don't you hate it when you try to go someplace but they're filming a movie? #nyc http://t.co/FSHjmaBMpk	40.72874613	-73.99967201	New York City, NY	117834664	1381270682	twitter_iphone
Can't wait to move into my new apartment.	40.80652365	-74.01878415	West New York	276041560	1381270685	twitter_iphone
retail. fucking. therapy. (@ Scotch &amp; Soda Sample Sale) http://t.co/ItusZRXG6S	40.7447605	-73.98712647	ny, ny 	25613074	1381270685	twitter_foursquare
One day I'm going to kick a guy for taking up all the space while sitting in the bus #closeyourdamnlegs	40.82159688	-73.99065136	Tres Metros Sobre el Cielo	1474574713	1381270686	twitter_iphone
don't say you miss me but never take time out of your day to come see me.	40.80327923	-73.94753728		1395168241	1381270689	twitter_iphone
I have a feeling that the #SPNfamily is going to break Twitter tonight.	40.75700794	-73.98931464	Brooklyn, NY	47487977	1381270692	twitter_iphone
I've mastered the art of never falling in love.	40.73392557	-73.99193773	Minnesota ✈ New York	101866674	1381270697	twitter_iphone
 Why do you have to hide your subjectivity? Why do you have to hide who you voted for?  @morningmika on false objectivity #morningjoeatcjs	40.80727431	-73.96329943	New York, NY	1658765257	1381270698	twitter_other
Starbucks hookupppp. Thanks ericcc	40.7535449	-74.0323692	NJ/NY	65410036	1381270703	twitter_android
 When I first started working at FOX news, I thought I'd find damaged carpets from all the knuckle-dragging.  -Sally Kohn at @TedConferences	40.72932435	-73.9918767	New York, NY, USA	15701519	1381270709	twitter_iphone
It gets dark too early now #thingsyourthinking #mattsmusings	40.7636743	-73.976885	Between EWR and LGA 	295459744	1381270736	twitter_iphone
You want what you can't have, ooh girl that's too damn bad	40.73635523	-73.90919091		33056636	1381270738	twitter_iphone
Purple Haze all in my brain	40.78392592	-74.01184276		427713915	1381270739	twitter_iphone
Check out the blog about my adventure being an artist. #blog #art #music #meetme	40.75394352	-73.99304776	New Jersey	102291441	1381270745	twitter_iphone
Sunset @ kingdom of Bushwick http://t.co/qkGmpTiKu6	40.70085333	-73.94159667	New York	125420284	1381270747	twitter_instagram
#NYU you can do all of this from your #Tapingo app. Order ahead, pickup &amp; enjoy. #burgerstudio. http://t.co/4aNIaJ74lq	40.73388409	-73.98931599	United States	238542936	1381270749	twitter_iphone
Happy Hour :) (@ No Fun - @nofun_nyc) http://t.co/mYGUAQ2cdd	40.72145329	-73.987813	Atlanta, GA	996194911	1381270752	twitter_foursquare
teachers phone just rang in class= cat fight sound ringtone	40.74444186	-73.93848895	Brooklyn	155037570	1381270754	twitter_other
I'm at LaGuardia Airport (LGA) (East Elmhurst, NY) w/ 113 others http://t.co/IBPTYXpipi	40.773839	-73.87122		16635117	1381270754	twitter_foursquare
Where the ffff is my iPhone?!!!!! #getwithitapple	40.73539827	-73.9942773	NYC/FL	349415587	1381270757	twitter_iphone
I'm at The Broadway Theatre for Cinderella (New York, NY) http://t.co/p4C6P17VbG	40.7632531	-73.98285085	California 	21043122	1381270761	twitter_foursquare
Me and Taylor got the last two wristbands and are gonna meet miley!!!! Freeeeeeakkkkin out right now	40.75787157	-73.98518795		377702596	1381270762	twitter_iphone
Had to make a stop at #amyruths #harlem.  Dinner pic to follow after it comes! @ Amy Ruth's http://t.co/83f20MYJ3t	40.80228842	-73.95045062	Baltimore, Maryland	85373673	1381270769	twitter_instagram
gummy bears for everyone aw	40.7581711	-73.9855481		488950452	1381270771	twitter_android
#tuesdaynightyoga (@ Exhale Spa - @exhalenyc w/ 2 others) http://t.co/fydX1RxCTH	40.7660539	-73.977934		16963117	1381270775	twitter_foursquare
 @britany_butler: We are a direct expression of the universe itself manifest in a third dimensional being. #EnlightenedYouth #ThirdEyeTribe 	40.7770441	-73.9865178		199120794	1381270779	twitter_android
The lovely @dkny and author @YuliZ! #SeasonOfChange http://t.co/dIWbN25QgR	40.74504076	-74.00600549	NYC	44891815	1381270781	twitter_iphone
Stocked out about being able to make my own team for the breast cancer walk and already people are willing to help by donating!	40.77346729	-73.90836342	New York 	464106047	1381270781	twitter_iphone
Long time-no-see, New York! What it's been, 14 years since we first met &amp; last saw each other? Thrilled to be back! http://t.co/l9N8S5xVzA	40.7507948	-73.99357639	Boston, MA	14538913	1381270782	twitter_foursquare
Whoa long day!	40.74496554	-73.97642199		1541784007	1381270783	twitter_iphone
i feel like shit my prof. switched classrooms so im going home, fuck this shit!!	40.69895142	-73.98556459	Brooklyn	525251395	1381270783	twitter_iphone
It's so much not a job as it is a predicament. #survivorjobs	40.76479551	-73.98369088	New York, NY, USA	455488072	1381270788	twitter_iphone
Brr! Justifying my insatiable hot chocolate addiction! (at @JacquesTorres Chocolate) http://t.co/OFu2CwjjMe	40.77940405	-73.98086071	10023, NYC	27767724	1381270790	twitter_foursquare
NYC cabs get there faster than Google Maps says. They should make it their slogan. #nyc #runninglate	40.76589414	-73.95735777	New York, NY	952081555	1381270792	twitter_iphone
Wedding 2nite #mula!!!	40.74495837	-73.97639844		1541784007	1381270794	twitter_iphone
 I don't care if you call me a dyke, as long as you spell it right.  @sallykohn spelling out emotional correctness. #TEDNYC @FoxNews	40.72787974	-73.99378796	New York	60212234	1381270796	twitter_iphone
Liberty without learning is always in peril learning without liberty is always in vain.	40.6978129	-73.9484528	Williamsburg, BK	117264210	1381270799	twitter_android
Cool pic of Nas on a billboard http://t.co/TfSLEmG1aZ	40.7685671	-73.9871465	On Cloud9T	32282481	1381270806	twitter_android
mi cosita linda http://t.co/JwcoOstAEn	40.81339273	-74.01124438	new jersey	488090325	1381270807	twitter_iphone
I'm at East End Wine Exchange (New York, NY) http://t.co/0FhHP45FpL	40.77275142	-73.94655304	New York, NY	579736870	1381270808	twitter_foursquare
Red light special. @ PH-D at Dream Downtown http://t.co/uahupxkM2j	40.74239352	-74.00330983	Philadelphia, PA	30948824	1381270809	twitter_instagram
I hate that I'm car sick, just taking the cab randomly is not an option for me	40.7174947	-73.95810266	Amsterdam	120204788	1381270814	twitter_other
The amount I hate everyone right now is astonishing	40.74952748	-73.99226773		233805580	1381270817	twitter_iphone
Today I had a quiz.. I had to listen to chants from 737337737 years ago and write their names... In Latin... I'm done.	40.81281548	-73.96173072	 ❂ New York, NY ❂	382216896	1381270823	twitter_iphone
Might have to get that authentic Sheldon Richardson b	40.7916399	-74.00024717	NJ/Home of The Jets 	38994410	1381270824	twitter_iphone
I'm at NYU Silver Center for Arts and Science - @nyuniversity (New York, NY) w/ 8 others http://t.co/KAwoPEI8P6	40.73035823	-73.99596436	NYC	38855118	1381270832	twitter_foursquare
I enjoy matching my outfits with my meals	40.71752231	-73.96010801	Brooklyn, NYC	137492186	1381270836	twitter_other
Sunset over the Hudson &amp; #NYC. Loving view from our @KimptonInNYC hotel. #divastakenyc @ Ink48 Hotel http://t.co/7F7pVXPQJa	40.76450443	-73.99580941	Seattle	52873382	1381270836	twitter_instagram
I'm at Lafayette w/ @hollymshapiro http://t.co/oLoG1Ni6Bk	40.72764903	-73.99360657	New York	39554674	1381270838	twitter_foursquare
It's sad how our whole lives revolve around school	40.70570201	-73.870013		460660547	1381270838	twitter_iphone
Having Geno driving me to try outs is not fun	40.74325215	-73.8981817		1008082706	1381270839	twitter_iphone
My teacher totally bought my shit project...#win #stillcrap	40.73902206	-73.98316673	New York City	904611025	1381270841	twitter_iphone
It is safe to assume that a guy named  Christoffer s parents were failed creative types.	40.75999064	-73.98696944	new yørk city 	193104440	1381270842	twitter_iphone
Mon taxi il veut que rouler comme une vieille alors que j'suis en retard d'au moins 40 min	40.70843545	-73.9399409	Ghetto Supafly	320114898	1381270846	twitter_iphone
It's not so much a job as it is a predicament #survivorjobs	40.76479427	-73.98369107	New York, NY, USA	455488072	1381270847	twitter_iphone
Excited for our Musicians on Call NYC advisory board mtg... (@ Norwood) http://t.co/8I0w3kF3SS	40.73948971	-74.00142758	New York City	17095748	1381270848	twitter_foursquare
Having dinner at the president's house, it's casual.	40.80634563	-73.9595777	New York, New York	18085765	1381270852	twitter_iphone
Funny, nobody bitching about the Jets WRs. Yall so bipolar lol	40.79175078	-74.00022694	NJ/Home of The Jets 	38994410	1381270852	twitter_iphone
I cannot complain, I cannot. http://t.co/vvL7hugkai	40.71588993	-74.03211347	New Yersey.	37805609	1381270867	twitter_iphone
Isn't it ironic that this week is customer appreciation week for NJ Transit and we are all delayed majorly. Fail @NJ_TRANSIT... a big fail.	40.74941338	-73.99231289	New Jersey/NYC	368408617	1381270868	twitter_iphone
I'm at New York Sports Club (New York, NY) w/ 4 others http://t.co/5SdBQl5vH3	40.749085	-73.98225698		46191124	1381270871	twitter_foursquare
Here to watch @MaxineBedat of @Zady speak at the #212retailpanel (@ New York Times Building - @nytimescomm) http://t.co/1aFnRoIriw	40.75606727	-73.99017334	New York, NY	14179769	1381270881	twitter_foursquare
There's a big difference between American cheese and American cheeses. #lifelessons	40.73056968	-73.99110428	New York, NY	21418983	1381270881	twitter_iphone
Great job @sallykohn #EmotionalCorrectness something to embrace - ps we dig @seanhannity too http://t.co/Pmpxv6udP0	40.72786844	-73.99362568	New York City	231569466	1381270883	twitter_iphone
I'm at @CharlieBirdNyc (New York, NY) http://t.co/U2Fj5jehjX	40.72781164	-74.00302649	NYC	254128464	1381270889	twitter_foursquare
h8 when it's cold because my ankle starts killing me	40.81347511	-74.01120798	new jersey	488090325	1381270890	twitter_iphone
I have to be there in 10 minutes bro	40.74253458	-73.89411681		1008082706	1381270891	twitter_iphone
